Branch,Department,Agency,Public APIs,Developer Hub,Write APIs
Legislative,~~~,Architect of the Capitol,,,
Legislative,~~~,Congressional Budget Office,,,
Legislative,~~~,Government Accountability Office,,,
Legislative,~~~,Government Printing Office,*,,
Legislative,~~~,Library of Congress,*,,
Legislative,~~~,Office of Compliance,,,
Legislative,~~~,United States Capitol Guide Service,,,
Legislative,~~~,United States Capitol Police,,,
Judicial ,~~~,Administrative Office of the United States Courts,*,,
Judicial ,~~~,Federal Judicial Center,,,
Judicial ,~~~,Judicial Conference of the United States,,,
Judicial ,~~~,Office of Probation and Pretrial Services,,,
Judicial ,~~~,United States Sentencing Commission,,,
Executive,Executive Office of the President ,~~~,*,+,^
Executive,Executive Office of the President ,Office of Management and Budget,*,,^
Executive,Agriculture,~~~,*,+,
Executive,Agriculture,Agricultural Marketing Service,*,,
Executive,Agriculture,Agricultural Research Service,*,,
Executive,Agriculture,Animal and Plant Health Inspection Service,*,,
Executive,Agriculture,Center for Nutrition Policy and Promotion,,,
Executive,Agriculture,Economic Research Service,*,+,
Executive,Agriculture,Farm Service Agency,*,,
Executive,Agriculture,Food and Nutrition Service,,,
Executive,Agriculture,Food Safety and Inspection Service,,,
Executive,Agriculture,Foreign Agricultural Service,,,
Executive,Agriculture,Forest Service,*,,
Executive,Agriculture,"Grain Inspection, Packers and Stockyards Admin.",,,
Executive,Agriculture,Marketing and Regulatory Programs,,,
Executive,Agriculture,National Agricultural Statistics Service,*,,
Executive,Agriculture,National Institute of Food and Agriculture,,,
Executive,Agriculture,Natural Resources Conservation Service,*,,
Executive,Agriculture,Risk Management Agency,,,
Executive,Agriculture,Rural Business and Cooperative Programs,,,
Executive,Agriculture,Office of Rural Development,,,
Executive,Agriculture,"Research, Education and Economics",,,
Executive,Agriculture,Rural Housing Service,,,
Executive,Agriculture,Rural Utilities Service,,,
Executive,Commerce,~~~,*,+,
Executive,Commerce,Bureau of Economic Analysis,*,+,
Executive,Commerce,Bureau of Industry and Security,,,
Executive,Commerce,Census Bureau,*,+,
Executive,Commerce,Economic Development Administration,,,
Executive,Commerce,Economics and Statistics Administration,,,
Executive,Commerce,Export Enforcement,,,
Executive,Commerce,Import Administration,,,
Executive,Commerce,International Trade Administration,*,+,
Executive,Commerce,Manufacturing and Services,,,
Executive,Commerce,Marine and Aviation Operations,,,
Executive,Commerce,Market Access and Compliance,,,
Executive,Commerce,Minority Business Development Agency,,,
Executive,Commerce,National Oceanic and Atmospheric Administration,*,,
Executive,Commerce,National Telecommunications and Information Admin.,*,,
Executive,Commerce,Patent and Trademark Office,*,,
Executive,Commerce,National Institute of Standards and Technology,*,,
Executive,Defense,~~~,*,+,
Executive,Defense,Army,*,,
Executive,Defense,Army Corps of Engineers,*,,
Executive,Defense,Navy,,,
Executive,Defense,Marine Corps,,,
Executive,Defense,Air Force,,,
Executive,Defense,Joint Chiefs of Staff,,,
Executive,Defense,National Guard Bureau,,,
Executive,Defense,Defense Advanced Research Projects Agency,,,
Executive,Defense,Defense Commissary Agency,,,
Executive,Defense,Defense Contract Audit Agency,,,
Executive,Defense,Defense Contract Management Agency,,,
Executive,Defense,Defense Finance and Accounting Service,,,
Executive,Defense,Defense Information Systems Agency,,,
Executive,Defense,Defense Intelligence Agency,,,
Executive,Defense,Defense Logistics Agency,,,
Executive,Defense,Defense Security Cooperation Agency,,,
Executive,Defense,Defense Security Service,,,
Executive,Defense,Defense Technical Information Center,,,
Executive,Defense,Defense Threat Reduction Agency,,,
Executive,Defense,Missile Defense Agency,,,
Executive,Defense,National Security Agency,,,
Executive,Defense,National Reconnaissance Office,,,
Executive,Defense,National Geospatial-Intelligence Agency,,,
Executive,Defense,Naval Criminal Investigative Service,,,
Executive,Defense,Pentagon Force Protection Agency,,,
Executive,Defense,United States Pentagon Police,,,
Executive,Defense,American Forces Information Service,,,
Executive,Defense,Defense Prisoner of War/Missing Personnel Office,,,
Executive,Defense,Defense Education Activity,,,
Executive,Defense,Defense Dependents Schools,,,
Executive,Defense,Defense Human Resources Activity,,,
Executive,Defense,Office of Economic Adjustment,,,
Executive,Defense,TRICARE Management Activity,,,
Executive,Defense,Washington Headquarters Services,,,
Executive,Defense,West Point Military Academy,,,
Executive,Education,~~~,*,+,
Executive,Energy,~~~,*,+,^
Executive,Energy,Energy Information Administration,*,+,
Executive,Energy,Federal Energy Regulatory Commission,,,
Executive,Energy,National Laboratories and Technology Centers,*,,^
Executive,Energy,National Nuclear Security Administration,,,
Executive,Energy,Power Marketing Administrations,,,
Executive,Health and Human Services,~~~,*,+,^
Executive,Health and Human Services,Administration on Aging,*,,
Executive,Health and Human Services,Administration for Children and Families,*,,
Executive,Health and Human Services,Agency for Healthcare Research and Quality,*,,
Executive,Health and Human Services,Centers for Disease Control and Prevention,*,,
Executive,Health and Human Services,Centers for Medicare and Medicaid Services,*,+,
Executive,Health and Human Services,Food and Drug Administration,*,+,
Executive,Health and Human Services,Health Resources and Services Administration,*,,
Executive,Health and Human Services,Patient Affordable Healthcare Act Program,,,
Executive,Health and Human Services,Indian Health Service,*,,
Executive,Health and Human Services,National Institutes of Health,*,+,
Executive,Health and Human Services,National Health Intelligence Service,,,
Executive,Health and Human Services,Public Health Service,,,
Executive,Health and Human Services,Substance Abuse and Mental Health Services Admin.,*,+,
Executive,Homeland Security,~~~,*,+,^
Executive,Homeland Security,Federal Emergency Management Agency,*,+,
Executive,Homeland Security,Federal Law Enforcement Training Center,,,
Executive,Homeland Security,Transportation Security Administration,*,,
Executive,Homeland Security,United States Citizenship and Immigration Services,*,,^
Executive,Homeland Security,United States Coast Guard,*,,
Executive,Homeland Security,United States Customs and Border Protection,,,
Executive,Homeland Security,United States Immigration and Customs Enforcement,*,,^
Executive,Homeland Security,United States Secret Service,,,
Executive,Housing and Urban Development,~~~,*,+,
Executive,Housing and Urban Development,Federal Housing Administration,,,
Executive,Housing and Urban Development,Federal Housing Finance Agency,,,
Executive,Interior,~~~,*,+,
Executive,Interior,Bureau of Indian Affairs,,,
Executive,Interior,Bureau of Land Management,*,,
Executive,Interior,Bureau of Ocean Energy Management,*,,
Executive,Interior,Bureau of Reclamation,,,
Executive,Interior,Bureau of Safety and Environmental Enforcement,,,
Executive,Interior,Fish and Wildlife Service,*,,
Executive,Interior,National Park Service,*,,
Executive,Interior,Office of Insular Affairs,,,
Executive,Interior,Office of Surface Mining,*,,
Executive,Interior,United States Geological Survey,*,+,
Executive,Justice,~~~,*,+,
Executive,Justice,Antitrust Division,,,
Executive,Justice,Asset Forfeiture Program,,,
Executive,Justice,"Bureau of Alcohol, Tobacco, Firearms and Explosives",*,+,
Executive,Justice,Civil Division,,,
Executive,Justice,Civil Rights Division,,,
Executive,Justice,Community Oriented Policing Services,,,
Executive,Justice,Community Relations Service,,,
Executive,Justice,Criminal Division,,,
Executive,Justice,Diversion Control Program,,,
Executive,Justice,Drug Enforcement Administration,*,,
Executive,Justice,Environment and Natural Resources Division,,,
Executive,Justice,Federal Bureau of Investigation,,,
Executive,Justice,Federal Bureau of Prisons,,,
Executive,Justice,Foreign Claims Settlement Commission,,,
Executive,Justice,INTERPOL - United States National Central Bureau,,,
Executive,Justice,Justice Management Division,,,
Executive,Justice,National Crime Information Center,,,
Executive,Justice,National Drug Intelligence Center,,,
Executive,Justice,National Institute of Corrections,,,
Executive,Justice,National Security Division,,,
Executive,Justice,Tax Division,,,
Executive,Justice,United States Attorneys,,,
Executive,Justice,United States Marshals,,,
Executive,Justice,United States Parole Commission,,,
Executive,Justice,United States Trustee Program,,,
Executive,Labor,~~~,*,+,
Executive,Labor,Bureau of International Labor Affairs,,,
Executive,Labor,Bureau of Labor Statistics,*,+,
Executive,Labor,Center for Faith-Based and Neighborhood Partnerships,,,
Executive,Labor,Employee Benefits Security Administration,,,
Executive,Labor,Employment and Training Administration,*,,
Executive,Labor,Job Corps,,,
Executive,Labor,Mine Safety and Health Administration,*,+,
Executive,Labor,Occupational Safety and Health Administration,*,+,
Executive,Labor,Veterans' Employment and Training Service,,,
Executive,Labor,Wage and Hour Division,*,+,
Executive,Labor,Women's Bureau,,,
Executive,State,~~~,*,+,
Executive,Transportation,~~~,*,+,
Executive,Transportation,Bureau of Transportation Statistics,,,
Executive,Transportation,Federal Aviation Administration,*,+,
Executive,Transportation,Federal Highway Administration,,,
Executive,Transportation,Federal Motor Carrier Safety Administration,*,+,
Executive,Transportation,Federal Railroad Administration,*,,
Executive,Transportation,Federal Transit Administration,,,
Executive,Transportation,Maritime Administration,,,
Executive,Transportation,National Highway Traffic Safety Administration,*,+,
Executive,Transportation,"Office of Intelligence, Security and Emergency Response",,,
Executive,Transportation,Pipeline and Hazardous Materials Safety Administration,,,
Executive,Transportation,Research and Innovative Technology Administration,,,
Executive,Transportation,St. Lawrence Seaway System,,,
Executive,Transportation,Surface Transportation Board,,,
Executive,Treasury,~~~,*,+,^
Executive,Treasury,Alcohol and Tobacco Tax and Trade Bureau,,,
Executive,Treasury,Bureau of Engraving and Printing,*,,
Executive,Treasury,Bureau of the Fiscal Service,*,,
Executive,Treasury,Community Development Financial Institutions Fund,,,
Executive,Treasury,Federal Consulting Group,,,
Executive,Treasury,Financial Crimes Enforcement Network,,,
Executive,Treasury,Internal Revenue Service,*,,^
Executive,Treasury,Office of the Comptroller of the Currency,,,
Executive,Treasury,Office of Financial Stability,,,
Executive,Treasury,United States Mint,,,
Executive,Veterans Affairs,~~~,*,+,
Executive,Veterans Affairs,National Cemetery Administration,*,,
Executive,Veterans Affairs,Veterans Benefits Administration,*,,
Executive,Veterans Affairs,Veterans Health Administration,,,
Independent,~~~,Administrative Conference of the United States,,,
Independent,~~~,Advisory Council on Historic Preservation,,,
Independent,~~~,African Development Foundation,,,
Independent,~~~,Amtrak (National Railroad Passenger Corporation),,,
Independent,~~~,Armed Forces Retirement Home,,,
Independent,~~~,Central Intelligence Agency,,,
Independent,~~~,Commission on Civil Rights,,,
Independent,~~~,Commodity Futures Trading Commission,,,
Independent,~~~,Consumer Financial Protection Bureau,*,+,
Independent,~~~,Consumer Product Safety Commission,*,,
Independent,~~~,Corporation for National and Community Service,,,
Independent,~~~,Court Services and Offender Supervision Agency,,,
Independent,~~~,Corporation for Public Broadcasting,,,
Independent,~~~,Defense Nuclear Facilities Safety Board,,,
Independent,~~~,Election Assistance Commission,,,
Independent,~~~,Environmental Protection Agency,*,+,^
Independent,~~~,Equal Employment Opportunity Commission,,,
Independent,~~~,Export-Import Bank of the United States,,,
Independent,~~~,Farm Credit Administration,,,
Independent,~~~,Federal Communications Commission,*,+,
Independent,~~~,Federal Deposit Insurance Corporation,,,
Independent,~~~,Federal Election Commission,,,
Independent,~~~,Federal Financial Institutions Examination Council,*,,
Independent,~~~,Federal Housing Finance Board,,,
Independent,~~~,Federal Labor Relations Authority,,,
Independent,~~~,Federal Maritime Commission,,,
Independent,~~~,Federal Mediation and Conciliation Service,,,
Independent,~~~,Federal Mine Safety and Health Review Commission,,,
Independent,~~~,Federal Reserve System,*,,
Independent,~~~,Federal Retirement Thrift Investment Board,,,
Independent,~~~,Federal Trade Commission,,,
Independent,~~~,General Services Administration,*,+,^
Independent,~~~,Helen Keller National Center,,,
Independent,~~~,Institute of Museum and Library Services,,,
Independent,~~~,Inter-American Foundation,,,
Independent,~~~,International Broadcasting Bureau,,,
Independent,~~~,International Trade Commission,*,,
Independent,~~~,Merit Systems Protection Board,,,
Independent,~~~,Millenium Challenge Corporation,*,+,
Independent,~~~,Military Postal Service Agency,,,
Independent,~~~,National Aeronautics and Space Administration,*,+,
Independent,~~~,National Archives and Records Administration,*,+,
Independent,~~~,National Capital Planning Commission,,,
Independent,~~~,National Constitution Center,,,
Independent,~~~,National Council on Disability,,,
Independent,~~~,National Credit Union Administration,,,
Independent,~~~,National Endowment for the Arts,,,
Independent,~~~,National Endowment for the Humanities,,,
Independent,~~~,National Labor Relations Board,,,
Independent,~~~,National Mediation Board,,,
Independent,~~~,National Science Foundation,*,+,
Independent,~~~,United States Antarctic Program,,,
Independent,~~~,United States Arctic Program,,,
Independent,~~~,National Transportation Safety Board,,,
Independent,~~~,Nuclear Regulatory Commission,*,+,
Independent,~~~,"Office of the Federal Coordinator, Alaska Natural Gas T.P.",,,
Independent,~~~,Occupational Safety and Health Review Commission,,,
Independent,~~~,Office of Compliance,,,
Independent,~~~,Office of Government Ethics,,,
Independent,~~~,Office of Personnel Management,*,+,
Independent,~~~,Office of Special Counsel,,,
Independent,~~~,Office of the National Counterintelligence Executive,,,
Independent,~~~,Office of the Director of National Intelligence,*,,
Independent,~~~,Overseas Private Investment Corporation,,,
Independent,~~~,Panama Canal Commission,,,
Independent,~~~,Peace Corps,,,
Independent,~~~,Pension Benefit Guaranty Corporation,,,
Independent,~~~,Postal Regulatory Commission,,,
Independent,~~~,Railroad Retirement Board,,,
Independent,~~~,Recovery Accountability and Transparency Board,*,+,
Independent,~~~,Securities and Exchange Commission,,,
Independent,~~~,Securities Investor Protection Corporation,,,
Independent,~~~,Selective Service System,,,
Independent,~~~,Small Business Administration,*,+,
Independent,~~~,Social Security Administration,*,+,
Independent,~~~,Tennessee Valley Authority,,,
Independent,~~~,U.S. Trade and Development Agency,,,
Independent,~~~,United States Agency for International Development,*,+,
Independent,~~~,United States Postal Service,*,,^
