Branch,Department,Agency,Public APIs,Developer Hub,Write APIs
Legislative,~~~,Library of Congress,x,,
Judicial ,~~~,Administrative Office of the United States Courts,x,,
Executive,Executive Office of the President ,~~~,x,x,x
Executive,Executive Office of the President ,Office of Management and Budget,x,,x
Executive,Department of Agriculture,~~~,x,x,
Executive,Department of Agriculture,Agricultural Marketing Service,x,,
Executive,Department of Agriculture,Agricultural Research Service,x,,
Executive,Department of Agriculture,Animal and Plant Health Inspection Service,x,,
Executive,Department of Agriculture,Center for Nutrition Policy and Promotion,,,
Executive,Department of Agriculture,Economic Research Service,x,x,
Executive,Department of Agriculture,Farm Service Agency,x,,
Executive,Department of Agriculture,Food and Nutrition Service,,,
Executive,Department of Agriculture,Food Safety and Inspection Service,,,
Executive,Department of Agriculture,Foreign Agricultural Service,,,
Executive,Department of Agriculture,Forest Service,x,,
Executive,Department of Agriculture,"Grain Inspection, Packers and Stockyards Administration",,,
Executive,Department of Agriculture,Marketing and Regulatory Programs,,,
Executive,Department of Agriculture,National Agricultural Statistics Service,x,,
Executive,Department of Agriculture,National Institute of Food and Agriculture,,,
Executive,Department of Agriculture,Natural Resources Conservation Service,x,,
Executive,Department of Agriculture,Risk Management Agency,,,
Executive,Department of Agriculture,Rural Business and Cooperative Programs,,,
Executive,Department of Agriculture,Office of Rural Development,,,
Executive,Department of Agriculture,"Research, Education and Economics",,,
Executive,Department of Agriculture,Rural Housing Service,,,
Executive,Department of Agriculture,Rural Utilities Service,,,
Executive,Department of Commerce,~~~,x,x,
Executive,Department of Commerce,Bureau of Economic Analysis,x,x,
Executive,Department of Commerce,Bureau of Industry and Security,,,
Executive,Department of Commerce,Census Bureau,x,x,
Executive,Department of Commerce,Economic Development Administration,,,
Executive,Department of Commerce,Economics and Statistics Administration,,,
Executive,Department of Commerce,Export Enforcement,,,
Executive,Department of Commerce,Import Administration,,,
Executive,Department of Commerce,International Trade Administration,x,x,
Executive,Department of Commerce,Manufacturing and Services,,,
Executive,Department of Commerce,Marine and Aviation Operations,,,
Executive,Department of Commerce,Market Access and Compliance,,,
Executive,Department of Commerce,Minority Business Development Agency,,,
Executive,Department of Commerce,National Oceanic and Atmospheric Administration,x,,
Executive,Department of Commerce,National Telecommunications and Information Administration,x,,
Executive,Department of Commerce,Patent and Trademark Office,x,,
Executive,Department of Commerce,National Institute of Standards and Technology,,,
Executive,Department of Commerce,Trade Promotion and the U.S. And Foreign Commercial Service,,,
Executive,Department of Defense,~~~,x,x,
Executive,Department of Defense,Army Corps of Engineers,x,,
Executive,Department of Education,~~~,x,x,
Executive,Department of Energy,~~~,x,x,x
Executive,Department of Energy,Energy Information Administration,x,x,
Executive,Department of Energy,Federal Energy Regulatory Commission,,,
Executive,Department of Energy,National Laboratories and Technology Centers,x,,x
Executive,Department of Energy,National Nuclear Security Administration,,,
Executive,Department of Energy,Power Marketing Administrations,,,
Executive,Department of Health and Human Services,~~~,x,x,x
Executive,Department of Health and Human Services,Administration on Aging,x,,
Executive,Department of Health and Human Services,Administration for Children and Families,x,,
Executive,Department of Health and Human Services,Agency for Healthcare Research and Quality,x,,
Executive,Department of Health and Human Services,Centers for Disease Control and Prevention,x,,
Executive,Department of Health and Human Services,Centers for Medicare and Medicaid Services,x,x,
Executive,Department of Health and Human Services,Food and Drug Administration,x,,
Executive,Department of Health and Human Services,Health Resources and Services Administration,x,,
Executive,Department of Health and Human Services,Patient Affordable Healthcare Act Program,,,
Executive,Department of Health and Human Services,Indian Health Service,x,,
Executive,Department of Health and Human Services,National Institutes of Health,x,,
Executive,Department of Health and Human Services,National Health Intelligence Service,,,
Executive,Department of Health and Human Services,Public Health Service,,,
Executive,Department of Health and Human Services,Substance Abuse and Mental Health Services Administration,x,x,
Executive,Department of Homeland Security,~~~,x,x,x
Executive,Department of Homeland Security,Federal Emergency Management Agency,x,x,
Executive,Department of Homeland Security,Federal Law Enforcement Training Center,,,
Executive,Department of Homeland Security,Transportation Security Administration,x,,
Executive,Department of Homeland Security,United States Citizenship and Immigration Services,x,,x
Executive,Department of Homeland Security,United States Coast Guard,,,
Executive,Department of Homeland Security,United States Customs and Border Protection,,,
Executive,Department of Homeland Security,United States Immigration and Customs Enforcement,x,,x
Executive,Department of Homeland Security,United States Secret Service,,,
Executive,Department of Housing and Urban Development,~~~,x,x,
Executive,Department of Housing and Urban Development,Federal Housing Administration,,,
Executive,Department of Housing and Urban Development,Federal Housing Finance Agency,,,
Executive,Department of the Interior,~~~,x,x,
Executive,Department of the Interior,Bureau of Indian Affairs,,,
Executive,Department of the Interior,Bureau of Land Management,x,,
Executive,Department of the Interior,Bureau of Ocean Energy Management,x,,
Executive,Department of the Interior,Bureau of Reclamation,,,
Executive,Department of the Interior,Bureau of Safety and Environmental Enforcement,,,
Executive,Department of the Interior,Fish and Wildlife Service,x,,
Executive,Department of the Interior,National Park Service,x,,
Executive,Department of the Interior,Office of Insular Affairs,,,
Executive,Department of the Interior,Office of Surface Mining,x,,
Executive,Department of the Interior,United States Geological Survey,x,x,
Executive,Department of Justice,~~~,x,x,
Executive,Department of Justice,Antitrust Division,,,
Executive,Department of Justice,Asset Forfeiture Program,,,
Executive,Department of Justice,"Bureau of Alcohol, Tobacco, Firearms and Explosives",x,x,
Executive,Department of Justice,Civil Division,,,
Executive,Department of Justice,Civil Rights Division,,,
Executive,Department of Justice,Community Oriented Policing Services,,,
Executive,Department of Justice,Community Relations Service,,,
Executive,Department of Justice,Criminal Division,,,
Executive,Department of Justice,Diversion Control Program,,,
Executive,Department of Justice,Drug Enforcement Administration,x,,
Executive,Department of Justice,Environment and Natural Resources Division,,,
Executive,Department of Justice,Federal Bureau of Investigation,,,
Executive,Department of Justice,Federal Bureau of Prisons,,,
Executive,Department of Justice,Foreign Claims Settlement Commission,,,
Executive,Department of Justice,INTERPOL - United States National Central Bureau,,,
Executive,Department of Justice,Justice Management Division,,,
Executive,Department of Justice,National Crime Information Center,,,
Executive,Department of Justice,National Drug Intelligence Center,,,
Executive,Department of Justice,National Institute of Corrections,,,
Executive,Department of Justice,National Security Division,,,
Executive,Department of Justice,Tax Division,,,
Executive,Department of Justice,United States Attorneys,,,
Executive,Department of Justice,United States Marshals,,,
Executive,Department of Justice,United States Parole Commission,,,
Executive,Department of Justice,United States Trustee Program,,,
Executive,Department of Labor,~~~,x,x,
Executive,Department of Labor,Bureau of International Labor Affairs,,,
Executive,Department of Labor,Bureau of Labor Statistics,x,x,
Executive,Department of Labor,Center for Faith-Based and Neighborhood Partnerships (DOL),,,
Executive,Department of Labor,Employee Benefits Security Administration,,,
Executive,Department of Labor,Employment and Training Administration,x,,
Executive,Department of Labor,Job Corps,,,
Executive,Department of Labor,Mine Safety and Health Administration,x,,
Executive,Department of Labor,Occupational Safety and Health Administration,x,,
Executive,Department of Labor,Veterans' Employment and Training Service,,,
Executive,Department of Labor,Wage and Hour Division,x,,
Executive,Department of Labor,Women's Bureau,,,
Executive,Department of State,~~~,x,x,
Executive,Department of Transportation,~~~,x,x,
Executive,Department of Transportation,Bureau of Transportation Statistics,,,
Executive,Department of Transportation,Federal Aviation Administration,x,x,
Executive,Department of Transportation,Federal Highway Administration,,,
Executive,Department of Transportation,Federal Motor Carrier Safety Administration,x,x,
Executive,Department of Transportation,Federal Railroad Administration,x,,
Executive,Department of Transportation,Federal Transit Administration,,,
Executive,Department of Transportation,Maritime Administration,,,
Executive,Department of Transportation,National Highway Traffic Safety Administration,x,x,
Executive,Department of Transportation,"Office of Intelligence, Security and Emergency Response",,,
Executive,Department of Transportation,Pipeline and Hazardous Materials Safety Administration,,,
Executive,Department of Transportation,Research and Innovative Technology Administration,,,
Executive,Department of Transportation,St. Lawrence Seaway System,,,
Executive,Department of Transportation,Surface Transportation Board,,,
Executive,Department of the Treasury,~~~,x,x,x
Executive,Department of the Treasury,Alcohol and Tobacco Tax and Trade Bureau,,,
Executive,Department of the Treasury,Bureau of Engraving and Printing,x,,
Executive,Department of the Treasury,Bureau of the Fiscal Service,,,
Executive,Department of the Treasury,Community Development Financial Institutions Fund,,,
Executive,Department of the Treasury,Federal Consulting Group,,,
Executive,Department of the Treasury,Financial Crimes Enforcement Network,,,
Executive,Department of the Treasury,Internal Revenue Service,x,,x
Executive,Department of the Treasury,Office of the Comptroller of the Currency,,,
Executive,Department of the Treasury,Office of Financial Stability,,,
Executive,Department of the Treasury,United States Mint,,,
Executive,Department of Veterans Affairs,~~~,x,x,
Executive,Department of Veterans Affairs,National Cemetery Administration,x,,
Executive,Department of Veterans Affairs,Veterans Benefits Administration,x,,
Executive,Department of Veterans Affairs,Veterans Health Administration,,,
Independent,~~~,Administrative Conference of the United States,,,
Independent,~~~,Advisory Council on Historic Preservation,,,
Independent,~~~,African Development Foundation,,,
Independent,~~~,Amtrak (National Railroad Passenger Corporation),,,
Independent,~~~,Armed Forces Retirement Home,,,
Independent,~~~,Central Intelligence Agency,,,
Independent,~~~,Commission on Civil Rights,,,
Independent,~~~,Commodity Futures Trading Commission,,,
Independent,~~~,Consumer Financial Protection Bureau,x,x,
Independent,~~~,Consumer Product Safety Commission,x,,
Independent,~~~,Corporation for National and Community Service,,,
Independent,~~~,Court Services and Offender Supervision Agency,,,
Independent,~~~,Corporation for Public Broadcasting,,,
Independent,~~~,Defense Nuclear Facilities Safety Board,,,
Independent,~~~,Election Assistance Commission,,,
Independent,~~~,Environmental Protection Agency,x,x,x
Independent,~~~,Equal Employment Opportunity Commission,,,
Independent,~~~,Export-Import Bank of the United States,,,
Independent,~~~,Farm Credit Administration,,,
Independent,~~~,Federal Communications Commission,x,x,
Independent,~~~,Federal Deposit Insurance Corporation,,,
Independent,~~~,Federal Election Commission,,,
Independent,~~~,Federal Financial Institutions Examination Council,x,,
Independent,~~~,Federal Housing Finance Board,,,
Independent,~~~,Federal Labor Relations Authority,,,
Independent,~~~,Federal Maritime Commission,,,
Independent,~~~,Federal Mediation and Conciliation Service,,,
Independent,~~~,Federal Mine Safety and Health Review Commission,,,
Independent,~~~,Federal Reserve System,x,,
Independent,~~~,Federal Retirement Thrift Investment Board,,,
Independent,~~~,Federal Trade Commission,,,
Independent,~~~,General Services Administration,x,x,x
Independent,~~~,Helen Keller National Center,,,
Independent,~~~,Institute of Museum and Library Services,,,
Independent,~~~,Inter-American Foundation,,,
Independent,~~~,International Broadcasting Bureau,,,
Independent,~~~,International Trade Commission,x,,
Independent,~~~,Merit Systems Protection Board,,,
Independent,~~~,Millenium Challenge Corporation,x,x,
Independent,~~~,Military Postal Service Agency,,,
Independent,~~~,National Aeronautics and Space Administration,x,x,
Independent,~~~,National Archives and Records Administration,x,x,
Independent,~~~,National Capital Planning Commission,,,
Independent,~~~,National Constitution Center,,,
Independent,~~~,National Council on Disability,,,
Independent,~~~,National Credit Union Administration,,,
Independent,~~~,National Endowment for the Arts,,,
Independent,~~~,National Endowment for the Humanities,,,
Independent,~~~,National Labor Relations Board,,,
Independent,~~~,National Mediation Board,,,
Independent,~~~,National Science Foundation,x,x,
Independent,~~~,United States Antarctic Program,,,
Independent,~~~,United States Arctic Program,,,
Independent,~~~,National Transportation Safety Board,,,
Independent,~~~,Nuclear Regulatory Commission,x,x,
Independent,~~~,"Office of the Federal Coordinator, Alaska Natural Gas Transportation Projects",,,
Independent,~~~,Occupational Safety and Health Review Commission,,,
Independent,~~~,Office of Compliance,,,
Independent,~~~,Office of Government Ethics,,,
Independent,~~~,Office of Personnel Management,x,x,
Independent,~~~,Office of Special Counsel,,,
Independent,~~~,Office of the National Counterintelligence Executive,,,
Independent,~~~,Office of the Director of National Intelligence,x,,
Independent,~~~,Overseas Private Investment Corporation,,,
Independent,~~~,Panama Canal Commission,,,
Independent,~~~,Peace Corps,,,
Independent,~~~,Pension Benefit Guaranty Corporation,,,
Independent,~~~,Postal Regulatory Commission,,,
Independent,~~~,Railroad Retirement Board,,,
Independent,,Recovery Accountability and Transparency Board,x,x,
Independent,~~~,Securities and Exchange Commission,,,
Independent,~~~,Securities Investor Protection Corporation,,,
Independent,~~~,Selective Service System,,,
Independent,~~~,Small Business Administration,x,x,
Independent,~~~,Social Security Administration,x,x,
Independent,~~~,Tennessee Valley Authority,,,
Independent,~~~,U.S. Trade and Development Agency,,,
Independent,~~~,United States Agency for International Development,x,x,
Independent,~~~,United States Postal Service,x,,x
